{
  "agentId": "urn:missionweave:agent:developer-one",
  "organizationId": "urn:missionweave:organization:acme",
  "cardVersion": 3,
  "displayName": "Developer Agent One",
  "description": "Implements and tests Python changes.",
  "owner": {"type": "human", "id": "urn:missionweave:human:platform-owner"},
  "status": "active",
  "protocolVersions": ["0.1"],
  "endpoints": [{"transport": "wss", "uri": "wss://agents.acme.example/developer-one"}],
  "publicKeys": [
    {
      "keyId": "urn:missionweave:key:developer-one",
      "algorithm": "Ed25519",
      "publicKey": "cHVibGlja2V5",
      "validFrom": "2026-07-01T00:00:00Z"
    }
  ],
  "capabilities": [
    {
      "id": "acme.software.python-implementation",
      "version": "2.1.0",
      "inputSchema": "https://schemas.acme.example/capabilities/python-implementation-input.json",
      "inputSchemaHash": "sha256:aaaaaaaaaaaaaaaaaaaaaaaaaaaaaaaaaaaaaaaaaaaaaaaaaaaaaaaaaaaaaaaa",
      "outputSchema": "https://schemas.acme.example/capabilities/python-implementation-output.json",
      "outputSchemaHash": "sha256:bbbbbbbbbbbbbbbbbbbbbbbbbbbbbbbbbbbbbbbbbbbbbbbbbbbbbbbbbbbbbbbb",
      "constraints": {"python": ">=3.12"},
      "verifiedEvidence": ["urn:missionweave:evidence:capability-python-2026"]
    }
  ],
  "maxConcurrency": 2,
  "issuedAt": "2026-07-01T00:00:00Z",
  "signature": {
    "algorithm": "Ed25519",
    "keyId": "urn:missionweave:key:organization-registry",
    "createdAt": "2026-07-01T00:00:00Z",
    "value": "c2lnbmF0dXJl"
  }
}
